{
  "schema_version": "1",
  "submission_id": "sub-team-gamma",
  "project_id": "proj-hack-2026",
  "team_name": "Гамма",
  "created_at": "2026-10-24T09:15:00Z",
  "materials": [
    {
      "material_id": "m-repo",
      "type": "repository",
      "source": {
        "kind": "url",
        "url": "https://github.com/team-gamma/doc-scanner"
      },
      "status": "available",
      "size_bytes": 18432000,
      "extracted": {
        "repo_dir": "projects/proj-hack-2026/submissions/sub-team-gamma/repo",
        "file_count": 214,
        "languages": [
          "Python",
          "TypeScript"
        ]
      }
    },
    {
      "material_id": "m-deck",
      "type": "presentation",
      "source": {
        "kind": "upload",
        "path": "projects/proj-hack-2026/submissions/sub-team-gamma/raw/deck.pdf"
      },
      "status": "available",
      "size_bytes": 2457600,
      "extracted": {
        "text_path": "projects/proj-hack-2026/submissions/sub-team-gamma/extracted/deck.txt",
        "slides_dir": "projects/proj-hack-2026/submissions/sub-team-gamma/extracted/slides",
        "slide_count": 10
      }
    },
    {
      "material_id": "m-demo",
      "type": "screencast",
      "source": {
        "kind": "upload",
        "path": "projects/proj-hack-2026/submissions/sub-team-gamma/raw/demo.mp4"
      },
      "status": "available",
      "size_bytes": 48234496,
      "extracted": {
        "frames_dir": "projects/proj-hack-2026/submissions/sub-team-gamma/extracted/frames",
        "transcript_path": "projects/proj-hack-2026/submissions/sub-team-gamma/extracted/demo.txt",
        "duration_seconds": 120.0
      }
    },
    {
      "material_id": "m-host",
      "type": "host",
      "source": {
        "kind": "url",
        "url": "https://doc-scanner.team-gamma.example/"
      },
      "status": "unavailable",
      "reason": "Хост не отвечает: три проверки подряд завершились таймаутом (30 с)",
      "meta": {
        "http_status": null,
        "availability_checks": 3,
        "last_error": "timeout"
      }
    }
  ],
  "completeness": {
    "status": "incomplete",
    "required": [
      "repository",
      "presentation",
      "host"
    ],
    "missing": [
      "host"
    ]
  },
  "limits_applied": [],
  "warnings": [
    "Хост недоступен на момент разбора: оценки по работающему продукту будут помечены no_data"
  ],
  "git": {
    "available": true,
    "first_commit_at": "2026-10-23T18:02:11Z",
    "last_commit_at": "2026-10-24T08:41:57Z",
    "commit_count": 57,
    "commits_before_start": 0,
    "history_rewritten": false,
    "log_path": "projects/proj-hack-2026/submissions/sub-team-gamma/git_log.json"
  },
  "masked_secrets": 0
}
